{
  "$schema": "http://json-schema.org/draft-07/schema#",
  "title": "CyberSoftRAGEvalBenchmarkQuestion",
  "type": "object",
  "required": [
    "question_id",
    "query",
    "category",
    "type",
    "reasoning_type",
    "expected_behavior",
    "ground_truth_answer",
    "citations",
    "anti_leakage_verified"
  ],
  "properties": {
    "question_id": {
      "type": "string",
      "pattern": "^Q[0-9]{3}$"
    },
    "query": {
      "type": "string",
      "minLength": 10
    },
    "category": {
      "type": "string"
    },
    "type": {
      "type": "string",
      "enum": [
        "Answerable - Single Hop",
        "Answerable - Multi Hop",
        "Unanswerable",
        "Adversarial / Distractor"
      ]
    },
    "reasoning_type": {
      "type": "string"
    },
    "expected_behavior": {
      "type": "string"
    },
    "ground_truth_answer": {
      "type": "string",
      "minLength": 15
    },
    "citations": {
      "type": "array",
      "items": {
        "type": "object",
        "required": [
          "document_id",
          "section_id",
          "text_citation"
        ],
        "properties": {
          "document_id": {
            "type": "string"
          },
          "section_id": {
            "type": "string"
          },
          "text_citation": {
            "type": "string"
          }
        }
      }
    },
    "reasoning": {
      "type": "string"
    },
    "anti_leakage_verified": {
      "type": "boolean"
    }
  }
}
