[
  {
    "question_id": "Q001",
    "query": "Điều kiện về thời lượng hoàn thành để học viên được quyền nộp đơn xin bảo lưu khóa học tại CyberSoft là gì?",
    "category": "Academic Policy",
    "type": "Answerable - Single Hop",
    "reasoning_type": "Direct Factual Retrieval",
    "expected_behavior": "Return factual answer strictly grounded in citation",
    "ground_truth_answer": "Học viên được quyền nộp đơn xin bảo lưu khóa học khi đã hoàn thành tối thiểu 20% và không quá 70% tổng thời lượng chương trình học, đồng thời phải hoàn thành đủ 100% nghĩa vụ học phí của giai đoạn đang học.",
    "citations": [
      {
        "document_id": "CS-POL-001",
        "section_id": "SEC-POL-001-01",
        "text_citation": "Học viên được quyền nộp đơn xin bảo lưu khóa học khi đã hoàn thành tối thiểu 20% và không quá 70% tổng thời lượng chương trình học."
      }
    ],
    "reasoning": "Truy xuất trực tiếp điều kiện tỷ lệ phần trăm hoàn thành khóa học từ Quy chế bảo lưu CS-POL-001.",
    "anti_leakage_verified": true
  },
  {
    "question_id": "Q002",
    "query": "Thời gian bảo lưu tối đa cho một khóa học và số lần bảo lưu tối đa được phép là bao nhiêu?",
    "category": "Academic Policy",
    "type": "Answerable - Single Hop",
    "reasoning_type": "Direct Factual Retrieval",
    "expected_behavior": "Return factual answer strictly grounded in citation",
    "ground_truth_answer": "Thời gian bảo lưu tối đa cho một khóa học là 06 tháng kể từ ngày phê duyệt, và mỗi học viên chỉ được phép bảo lưu tối đa 02 lần trong suốt toàn bộ lộ trình học tập.",
    "citations": [
      {
        "document_id": "CS-POL-001",
        "section_id": "SEC-POL-001-02",
        "text_citation": "Thời gian bảo lưu tối đa cho một khóa học là 06 tháng kể từ ngày đơn bảo lưu được phê duyệt chính thức. Mỗi học viên chỉ được phép bảo lưu tối đa 02 lần trong suốt toàn bộ lộ trình học tập tại CyberSoft."
      }
    ],
    "reasoning": "Truy xuất trực tiếp giới hạn thời hạn và số lần bảo lưu từ SEC-POL-001-02.",
    "anti_leakage_verified": true
  },
  {
    "question_id": "Q003",
    "query": "Học viên cần gửi Phiếu yêu cầu bảo lưu trước ngày dự kiến bắt đầu nghỉ học tối thiểu bao nhiêu ngày làm việc?",
    "category": "Academic Policy",
    "type": "Answerable - Single Hop",
    "reasoning_type": "Direct Factual Retrieval",
    "expected_behavior": "Return factual answer strictly grounded in citation",
    "ground_truth_answer": "Học viên phải gửi Phiếu yêu cầu bảo lưu (mẫu CS-F-01) qua cổng CyberSoft Portal hoặc nộp trực tiếp tại phòng Học vụ trước tối thiểu 07 ngày làm việc so với ngày dự kiến bắt đầu nghỉ học.",
    "citations": [
      {
        "document_id": "CS-POL-001",
        "section_id": "SEC-POL-001-03",
        "text_citation": "trước tối thiểu 07 ngày làm việc so với ngày dự kiến bắt đầu nghỉ học"
      }
    ],
    "reasoning": "Truy xuất quy định về thời hạn nộp đơn bảo lưu từ SEC-POL-001-03.",
    "anti_leakage_verified": true
  },
  {
    "question_id": "Q004",
    "query": "Học viên bảo lưu trên 3 tháng khi làm thủ tục học lại sẽ phải đóng mức phí cập nhật học liệu như thế nào?",
    "category": "Academic Policy",
    "type": "Answerable - Single Hop",
    "reasoning_type": "Direct Factual Retrieval",
    "expected_behavior": "Return factual answer strictly grounded in citation",
    "ground_truth_answer": "Học viên bảo lưu trên 3 tháng khi tiếp tục học lại sẽ phải đóng mức phí cập nhật học liệu tối đa 10% học phí khóa học nếu chương trình có cập nhật hoặc phát sinh chênh lệch.",
    "citations": [
      {
        "document_id": "CS-POL-001",
        "section_id": "SEC-POL-001-04",
        "text_citation": "nếu bảo lưu trên 3 tháng sẽ đóng mức phí cập nhật học liệu tối đa 10% học phí khóa học."
      }
    ],
    "reasoning": "Truy xuất mức phí bù tài liệu khi bảo lưu trên 3 tháng từ SEC-POL-001-04.",
    "anti_leakage_verified": true
  },
  {
    "question_id": "Q005",
    "query": "Biện pháp xử lý của CyberSoft đối với học viên để quá thời hạn bảo lưu tối đa 06 tháng mà không quay lại học là gì?",
    "category": "Academic Policy",
    "type": "Answerable - Single Hop",
    "reasoning_type": "Direct Factual Retrieval",
    "expected_behavior": "Return factual answer strictly grounded in citation",
    "ground_truth_answer": "Hệ thống CyberSoft Portal sẽ tự động hủy kích hoạt tài khoản học tập; học viên bị coi là tự ý bỏ học và toàn bộ học phí đã đóng sẽ không được hoàn trả dưới bất kỳ hình thức nào.",
    "citations": [
      {
        "document_id": "CS-POL-001",
        "section_id": "SEC-POL-001-05",
        "text_citation": "hệ thống CyberSoft Portal sẽ tự động hủy kích hoạt tài khoản học tập. Trong trường hợp này, học viên bị coi là tự ý bỏ học và toàn bộ học phí đã đóng sẽ không được hoàn trả dưới bất kỳ hình thức nào."
      }
    ],
    "reasoning": "Truy xuất chế tài xử lý quá hạn bảo lưu từ SEC-POL-001-05.",
    "anti_leakage_verified": true
  },
  {
    "question_id": "Q006",
    "query": "Quy định hoàn tiền học phí khi học viên rút hồ sơ trước ngày khai giảng từ 05 ngày làm việc trở lên là gì?",
    "category": "Academic Policy",
    "type": "Answerable - Single Hop",
    "reasoning_type": "Direct Factual Retrieval",
    "expected_behavior": "Return factual answer strictly grounded in citation",
    "ground_truth_answer": "Học viên gửi yêu cầu rút hồ sơ trước khai giảng từ 05 ngày làm việc trở lên sẽ được hoàn trả 100% học phí thực đóng sau khi khấu trừ 500.000 VNĐ chi phí xử lý thủ tục hành chính và tài khoản học liệu.",
    "citations": [
      {
        "document_id": "CS-POL-002",
        "section_id": "SEC-POL-002-01",
        "text_citation": "Học viên gửi văn bản yêu cầu rút hồ sơ trước ngày khai giảng chính thức từ 05 ngày làm việc trở lên sẽ được hoàn trả 100% học phí thực đóng sau khi khấu trừ 500.000 VNĐ chi phí xử lý thủ tục hành chính và tài khoản học liệu trực tuyến."
      }
    ],
    "reasoning": "Truy xuất mức hoàn phí trước khai giảng >= 5 ngày từ SEC-POL-002-01.",
    "anti_leakage_verified": true
  },
  {
    "question_id": "Q007",
    "query": "Mức hoàn trả học phí tối đa khi học viên nộp đơn dừng học trong 03 buổi học đầu tiên là bao nhiêu?",
    "category": "Academic Policy",
    "type": "Answerable - Single Hop",
    "reasoning_type": "Direct Factual Retrieval",
    "expected_behavior": "Return factual answer strictly grounded in citation",
    "ground_truth_answer": "Học viên nộp đơn dừng học trong vòng 03 buổi học đầu tiên của khóa học sẽ được xem xét hoàn trả tối đa 70% học phí thực tế đã đóng.",
    "citations": [
      {
        "document_id": "CS-POL-002",
        "section_id": "SEC-POL-002-02",
        "text_citation": "Học viên nộp đơn xin dừng học trong vòng 03 buổi học đầu tiên của khóa học (kể cả trường hợp vắng mặt không phép) sẽ được xem xét hoàn trả tối đa 70% học phí thực tế đã đóng."
      }
    ],
    "reasoning": "Truy xuất tỷ lệ hoàn phí trong 3 buổi đầu từ SEC-POL-002-02.",
    "anti_leakage_verified": true
  },
  {
    "question_id": "Q008",
    "query": "Khoản học phí được phê duyệt hoàn trả sẽ được chi trả bằng hình thức nào và trong thời gian bao lâu?",
    "category": "Academic Policy",
    "type": "Answerable - Single Hop",
    "reasoning_type": "Direct Factual Retrieval",
    "expected_behavior": "Return factual answer strictly grounded in citation",
    "ground_truth_answer": "Chi trả độc quyền qua hình thức chuyển khoản ngân hàng chính chủ của học viên hoặc người giám hộ trong thời hạn 10 ngày làm việc kể từ ngày phát hành Phiếu xác nhận hoàn phí điện tử.",
    "citations": [
      {
        "document_id": "CS-POL-002",
        "section_id": "SEC-POL-002-03",
        "text_citation": "chi trả độc quyền qua hình thức chuyển khoản ngân hàng chính chủ của học viên hoặc phụ huynh/người giám hộ hợp pháp đã đứng tên ký hợp đồng đào tạo. Thời hạn hoàn tiền là 10 ngày làm việc kể từ ngày Phòng Kế toán phát hành Phiếu xác nhận hoàn phí điện tử."
      }
    ],
    "reasoning": "Truy xuất phương thức chuyển khoản và thời hạn hoàn tiền từ SEC-POL-002-03.",
    "anti_leakage_verified": true
  },
  {
    "question_id": "Q009",
    "query": "Những khóa học hoặc trường hợp nào hoàn toàn không được áp dụng chính sách hoàn trả học phí?",
    "category": "Academic Policy",
    "type": "Answerable - Single Hop",
    "reasoning_type": "Direct Factual Retrieval",
    "expected_behavior": "Return factual answer strictly grounded in citation",
    "ground_truth_answer": "Không áp dụng cho các khóa học ưu đãi học bổng từ 50% trở lên, khóa học doanh nghiệp tài trợ trọn gói, học viên bị buộc thôi học do kỷ luật, hoặc khóa kỹ năng ngắn hạn dưới 15 giờ học.",
    "citations": [
      {
        "document_id": "CS-POL-002",
        "section_id": "SEC-POL-002-04",
        "text_citation": "Chính sách hoàn phí không áp dụng cho các khóa học thuộc diện ưu đãi học bổng đặc biệt từ 50% trở lên, các khóa học theo diện doanh nghiệp tài trợ trọn gói, học viên vi phạm quy chế kỷ luật dẫn đến bị buộc thôi học, hoặc các khóa học kỹ năng ngắn hạn có tổng thời lượng dưới 15 giờ học."
      }
    ],
    "reasoning": "Truy xuất các ngoại lệ không hoàn phí từ SEC-POL-002-04.",
    "anti_leakage_verified": true
  },
  {
    "question_id": "Q010",
    "query": "Học viên cần tham gia tối thiểu bao nhiêu phần trăm tổng số buổi học để đủ điều kiện xét tốt nghiệp?",
    "category": "Academic Policy",
    "type": "Answerable - Single Hop",
    "reasoning_type": "Direct Factual Retrieval",
    "expected_behavior": "Return factual answer strictly grounded in citation",
    "ground_truth_answer": "Học viên phải bảo đảm tham gia tối thiểu 80% tổng số buổi học của toàn bộ khóa học để đủ điều kiện xét tốt nghiệp.",
    "citations": [
      {
        "document_id": "CS-POL-003",
        "section_id": "SEC-POL-003-01",
        "text_citation": "Học viên phải bảo đảm tham gia tối thiểu 80% tổng số buổi học của toàn bộ khóa học để đủ điều kiện xét tốt nghiệp."
      }
    ],